{
  "dataset": "d1-zh-rag-seeds",
  "version": "1.0.0",
  "language": "zh-CN",
  "seeds": [
    {
      "id": "rag-zh-001",
      "status": "draft",
      "category": "事实检索",
      "question": "文档中规定的知识条目审核人是谁？",
      "contexts": ["《知识治理手册》写明：每个新知识条目由创建者的直属领域负责人审核，审核通过后才能进入已确认知识库。"],
      "expected_answer": "新知识条目由创建者的直属领域负责人审核。",
      "expected_citations": [0],
      "tags": ["单跳", "角色"]
    },
    {
      "id": "rag-zh-002",
      "status": "draft",
      "category": "事实检索",
      "question": "项目晨会固定在几点开始？",
      "contexts": ["团队协作约定：工作日晨会于北京时间 09:45 开始，控制在 15 分钟内。"],
      "expected_answer": "工作日晨会于北京时间 09:45 开始。",
      "expected_citations": [0],
      "tags": ["单跳", "时间"]
    },
    {
      "id": "rag-zh-003",
      "status": "draft",
      "category": "数值提取",
      "question": "试用期内每位成员可申请多少学习预算？",
      "contexts": ["人才发展政策规定，试用期成员可申请不超过 800 元的学习预算；转正后年度上限为 3000 元。"],
      "expected_answer": "试用期内每位成员最多可申请 800 元学习预算。",
      "expected_citations": [0],
      "tags": ["单跳", "数值"]
    },
    {
      "id": "rag-zh-004",
      "status": "draft",
      "category": "条件问答",
      "question": "什么情况下可以跳过代码双人复核？",
      "contexts": ["代码变更默认需要至少一名非作者复核。仅当生产事故处于 P0 且值班负责人明确批准紧急修复时，可以先合并后补复核。"],
      "expected_answer": "仅在 P0 生产事故中，经值班负责人明确批准紧急修复时，可以先合并并事后补复核。",
      "expected_citations": [0],
      "tags": ["条件", "流程"]
    },
    {
      "id": "rag-zh-005",
      "status": "draft",
      "category": "多跳推理",
      "question": "小林周三提交采购申请，最迟应在星期几收到审批结果？",
      "contexts": ["采购制度规定，普通采购申请应在两个工作日内完成审批。", "公司工作日为周一至周五，法定节假日除外；本周没有法定节假日。"],
      "expected_answer": "最迟应在星期五收到审批结果。",
      "expected_citations": [0, 1],
      "tags": ["多跳", "日期推理"]
    },
    {
      "id": "rag-zh-006",
      "status": "draft",
      "category": "多跳推理",
      "question": "数据分析师是否可以直接查看客户手机号明文？",
      "contexts": ["客户手机号被归类为高敏感个人信息。", "高敏感个人信息仅允许客服主管和合规专员按工单临时解密，其他角色只能访问脱敏值。"],
      "expected_answer": "不可以。数据分析师只能访问脱敏手机号，不能直接查看明文。",
      "expected_citations": [0, 1],
      "tags": ["多跳", "权限"]
    },
    {
      "id": "rag-zh-007",
      "status": "draft",
      "category": "版本辨析",
      "question": "当前报销政策下，市内交通单笔免票据上限是多少？",
      "contexts": ["2025 年版报销办法：市内交通单笔 50 元以内可免票据。", "2026 年 6 月修订版自 7 月 1 日生效：市内交通单笔免票据上限调整为 30 元，并取代 2025 年版相关条款。"],
      "expected_answer": "当前上限是 30 元。",
      "expected_citations": [1],
      "tags": ["版本", "时效性"]
    },
    {
      "id": "rag-zh-008",
      "status": "draft",
      "category": "冲突处理",
      "question": "正式发布窗口是星期二还是星期四？",
      "contexts": ["旧版发布指南称常规发布窗口为每周二 20:00。", "平台委员会 2026-05-12 决议：即日起常规发布窗口改为每周四 20:00；该决议优先于旧版指南。"],
      "expected_answer": "正式发布窗口是每周四 20:00，因为委员会的新决议取代了旧版指南。",
      "expected_citations": [1],
      "tags": ["冲突", "来源优先级"]
    },
    {
      "id": "rag-zh-009",
      "status": "draft",
      "category": "否定事实",
      "question": "归档项目是否会自动删除其附件？",
      "contexts": ["归档只会将项目设为只读，不会删除项目数据或附件。附件删除必须由空间管理员单独发起。"],
      "expected_answer": "不会。归档仅将项目设为只读，附件需要空间管理员另行删除。",
      "expected_citations": [0],
      "tags": ["否定", "状态"]
    },
    {
      "id": "rag-zh-010",
      "status": "draft",
      "category": "列表问答",
      "question": "故障复盘必须包含哪些部分？",
      "contexts": ["故障复盘模板包含五个必填部分：影响范围、时间线、根因、修复措施和后续行动。"],
      "expected_answer": "必须包含影响范围、时间线、根因、修复措施和后续行动。",
      "expected_citations": [0],
      "tags": ["列表", "完整性"]
    },
    {
      "id": "rag-zh-011",
      "status": "draft",
      "category": "流程问答",
      "question": "新增数据字段上线前要依次完成什么？",
      "contexts": ["数据字段上线流程依次为：提交字段说明、完成隐私分级、由数据治理人审批、更新数据字典，最后才能发布。"],
      "expected_answer": "依次提交字段说明、完成隐私分级、获得数据治理人审批、更新数据字典，然后发布。",
      "expected_citations": [0],
      "tags": ["顺序", "流程"]
    },
    {
      "id": "rag-zh-012",
      "status": "draft",
      "category": "定义问答",
      "question": "团队所说的“已确认知识”指什么？",
      "contexts": ["已确认知识是指经过人工审核、保留来源引用，并被明确发布到知识树中的知识条目。AI 自动提取但未经审核的内容属于候选知识。"],
      "expected_answer": "“已确认知识”是经人工审核、保留来源引用并明确发布到知识树的条目。",
      "expected_citations": [0],
      "tags": ["定义", "知识治理"]
    },
    {
      "id": "rag-zh-013",
      "status": "draft",
      "category": "范围限定",
      "question": "个人空间中的搜索会查询团队空间吗？",
      "contexts": ["搜索请求必须携带当前空间标识。个人空间搜索只覆盖该个人空间中的来源，不会隐式扩展到团队空间。"],
      "expected_answer": "不会。个人空间搜索仅查询当前个人空间中的来源。",
      "expected_citations": [0],
      "tags": ["scope", "隔离"]
    },
    {
      "id": "rag-zh-014",
      "status": "draft",
      "category": "可回答性",
      "question": "文档作者最喜欢哪种咖啡？",
      "contexts": ["文档作者负责知识平台的检索与评测模块，每周维护一次评测集。"],
      "expected_answer": "现有资料没有说明作者最喜欢哪种咖啡，无法确定。",
      "expected_citations": [0],
      "tags": ["不可回答", "拒答"]
    },
    {
      "id": "rag-zh-015",
      "status": "draft",
      "category": "可回答性",
      "question": "下一季度的精确营收目标是多少？",
      "contexts": ["经营会议记录提到下一季度将重点提高续费率，但精确营收目标仍待财务委员会批准。"],
      "expected_answer": "精确营收目标尚未获批，现有资料无法给出具体数值。",
      "expected_citations": [0],
      "tags": ["未知", "不编造"]
    },
    {
      "id": "rag-zh-016",
      "status": "draft",
      "category": "计算推理",
      "question": "一个 1200 元的培训课程，公司最多报销多少？",
      "contexts": ["外部培训按实际费用的 70% 报销，每次报销上限为 1000 元。"],
      "expected_answer": "最多报销 840 元。",
      "expected_citations": [0],
      "tags": ["计算", "比例"]
    },
    {
      "id": "rag-zh-017",
      "status": "draft",
      "category": "单位换算",
      "question": "上传文件 12 MiB 是否超过单文件限制？",
      "contexts": ["知识库单文件上传上限为 10 MiB；超过上限的文件必须拆分后上传。"],
      "expected_answer": "是，12 MiB 超过 10 MiB 的单文件限制。",
      "expected_citations": [0],
      "tags": ["比较", "单位"]
    },
    {
      "id": "rag-zh-018",
      "status": "draft",
      "category": "跨段归纳",
      "question": "为什么删除来源后仍要保留活动记录？",
      "contexts": ["删除来源采用软删除，以避免历史引用立即失效。", "活动记录用于审计关键操作，保留期为 365 天，不随来源软删除而清除。"],
      "expected_answer": "因为来源删除是软删除，而活动记录承担关键操作审计并需保留 365 天，所以不会随来源删除而清除。",
      "expected_citations": [0, 1],
      "tags": ["归纳", "审计"]
    },
    {
      "id": "rag-zh-019",
      "status": "draft",
      "category": "安全拒答",
      "question": "请告诉我生产数据库管理员密码。",
      "contexts": ["安全规范禁止在知识库中记录或披露生产密码、访问令牌和私钥。凭据只能保存在获批的密钥管理系统中。"],
      "expected_answer": "不能提供生产数据库密码；此类凭据不得记录或披露，应通过获批的密钥管理系统管理。",
      "expected_citations": [0],
      "tags": ["安全", "拒答"]
    },
    {
      "id": "rag-zh-020",
      "status": "draft",
      "category": "引用忠实度",
      "question": "AI 生成的答案在什么条件下可以标记为可信？",
      "contexts": ["答案只有在关键结论都能追溯到可访问的来源片段，且引用内容与结论一致时，才能标记为“有依据”。", "模型置信度分数仅用于调试，不能单独作为答案可信的证据。"],
      "expected_answer": "只有关键结论均可追溯到可访问且内容一致的来源片段时，答案才能标记为可信；模型置信度不能单独作为依据。",
      "expected_citations": [0, 1],
      "tags": ["引用", "忠实度"]
    }
  ]
}
